{
  "brand": "Autopilot",
  "compatible_series": "PX1",
  "name": "USB-RJ12 Controller Cable Pack, 15' (for Phantoms)",
  "type": "controller_cable",
  "price_amount": 23.99,
  "price_currency": "USD",
  "source_url": "https://cannavista.com/grow-equipment-supplies/growing-accessories/parts-and-accessories/usb-rj12-controller-cable-pack-15-for-phantoms/",
  "source_type": "retailer",
  "source_date": "2026-06-28",
  "notes": "SKU PHCBPK; pack includes 15 ft RJ12-RJ12 trunk cable, RJ12 splitter tee, and 15 ft USB-RJ12 cable for connecting Phantom 40 Series DE ballasts to PX1"
}