{
  "brand": "Inkbird",
  "compatible_series": "ITC-308 / ITC-306T / ITC-1000",
  "name": "INKBIRD Replacement 12\" NTC Probe for ITC-306T, ITC-308, ITC-1000",
  "type": "replacement_probe",
  "price_amount": 15.99,
  "price_currency": "USD",
  "source_url": "https://www.inkbird.com/products/replacement-12-ntc-probe-for-itc-306t-itc-308-itc-1000",
  "source_type": "manufacturer",
  "source_date": "2026-06-28",
  "notes": "12-inch (30 cm) stainless steel NTC probe; also listed on the EU store at €15.99. Suitable for fermentation vessels, grow reservoirs, incubators."
}