{
  "brand": "Gavita",
  "compatible_series": "EL1/EL2",
  "name": "Gavita Interconnect Cable for Repeater Bus Gray 6P6C 3m / 10ft",
  "type": "rj12_cable",
  "price_amount": null,
  "price_currency": null,
  "source_url": "https://growlightcentral.com/products/gavita-interconnect-cable-for-repeater-bus-gray-6p6c-3-m-10-ft",
  "source_type": "retailer",
  "source_date": "2026-06-28",
  "notes": "Longer gray Repeater Bus cable with ferrite coils; 6P6C connectors. For Repeater Bus fixtures (277V/400V systems)."
}