{
  "brand": "GSE",
  "compatible_series": null,
  "name": "GSE Smoke Detector for SMS Alarm Controller",
  "type": "sensor_probe",
  "price_amount": 37.9,
  "price_currency": "EUR",
  "source_url": "https://www.hydroponics.eu/gse-grow-room-sms-alarm-controller-kit~21076.html",
  "source_type": "retailer",
  "source_date": "2026-06-28",
  "notes": "6m cable and connector; expansion smoke detection sensor for GSE SMS Alarm Controller; triggers SMS alert on detection"
}