{
  "brand": "AC Infinity",
  "compatible_series": "Controller 69 Pro",
  "name": "69 Pro Climate Sensor, VPD, Temperature, and Humidity Readings, 20 ft",
  "type": "temp_humidity_sensor",
  "price_amount": 19.3,
  "price_currency": "EUR",
  "source_url": "https://acinfinity.com/69-pro-climate-sensor-vpd-temperature-and-humidity-readings-20/",
  "source_type": "manufacturer",
  "source_date": "2026-06-28",
  "notes": "Model AC-SPB20, 3.5mm plug, 50cm stainless steel probe, 6.1m (20ft) cord. Compatible with T-Series controllers. Long cord for spot detection in HVAC ducts."
}