{
  "brand": "AC Infinity",
  "compatible_series": "UIS",
  "name": "UIS Power Adapter, Outlet Plug with Charger Cable Cord",
  "type": "power_module",
  "price_amount": 14.91,
  "price_currency": "EUR",
  "source_url": "https://acinfinity.com/uis-power-adapter-outlet-plug-with-charger-cable-cord/",
  "source_type": "manufacturer",
  "source_date": "2026-06-28",
  "notes": "Powers UIS controllers (Controller 69, 69 WiFi, 69 Pro) that are not powered by UIS devices. Type-A/B compatible outlet plug with charging cable."
}