{
  "brand": "TechGrow",
  "compatible_series": null,
  "name": "TechGrow S-4 CO2 Sensor (10,000ppm)",
  "type": "co2_sensor",
  "price_amount": 318.68,
  "price_currency": "EUR",
  "source_url": "https://www.techgrow.nl/s-4-co2-sensor-10-000ppm.html",
  "source_type": "manufacturer",
  "source_date": "2026-06-28",
  "notes": "Extended-range S-4; CO2 0-10000ppm plus temperature, RH, and light; NDIR"
}