{
  "brand": "Mars Hydro",
  "compatible_series": "iControl",
  "name": "Mars Hydro 3PCS Smart Soil Sensor Kit",
  "type": "soil_sensor",
  "price_amount": 79.99,
  "price_currency": "EUR",
  "source_url": "https://marshydro.eu/products/soil-sensor/",
  "source_type": "manufacturer",
  "source_date": "2026-06-28",
  "notes": "Three 3-in-1 soil sensors each measuring moisture, temperature, and EC (electrical conductivity); for multi-plant or multi-zone monitoring; requires iControl or iHub Pro; pre-order status as of June 2026 with delivery mid-July 2026; EU direct sale only, not found on Amazon.de"
}