{
  "brand": "Spider Farmer",
  "compatible_series": "GGS",
  "name": "Spider Farmer 10-Port GGS Pro Adapter",
  "type": "expansion_module",
  "price_amount": null,
  "price_currency": null,
  "source_url": "https://spiderfarmer.com.au/products/spider-farmer-10-port-ggs-pro-adapter/",
  "source_type": "manufacturer",
  "source_date": "2026-06-28",
  "notes": "RJ12 hub with 10 numbered ports; expands RJ12 connectivity for the GGS ecosystem (humidifiers, fans, sensors, etc.). Compatible with GGS Controller, AC5, AC10, Pro Controller, and S-Station. Includes 1x RJ12 cable. AUD $22.99; not found on Amazon.de. US product page returning 404 at time of research."
}