{
  "brand": "Gavita",
  "compatible_series": "EL1/EL2",
  "name": "Gavita E-Series LED Adapter Interconnect Cable 10ft RJ45 to RJ45",
  "type": "extension_cable",
  "price_amount": 9.95,
  "price_currency": "USD",
  "source_url": "https://www.advancedhydrogardens.com/products/gavita-e-series-led-adapter-and-cables",
  "source_type": "retailer",
  "source_date": "2026-06-28",
  "notes": "SKU HGC906716. Standard daisy-chain cable for E-Series LED adapter network; RJ45 both ends. Amazon.com ASIN B09LPD8ZZD."
}