{
  "brand": "GrowControl",
  "compatible_series": "GrowBase Pro",
  "name": "In/Out-Splitter for GrowBase Pro",
  "type": "splitter",
  "price_amount": 15,
  "price_currency": "EUR",
  "source_url": "https://growcontrol.de/en_GB/shop/gc0030-in-out-splitter-for-growbase-pro-513",
  "source_type": "manufacturer",
  "source_date": "2026-06-28",
  "notes": "Expands GrowBase Pro In/Out ports from 5 to max 10 (up to 5 splitters); includes 0.5m RJ45 cable; not interchangeable with generic RJ45 Y-adapters; GrowBase Pro only"
}