{
  "brand": "Bluelab",
  "compatible_series": "Pro Controller",
  "name": "Bluelab Pro Controller Conductivity Probe (PROBPCEC)",
  "type": "ec_probe",
  "price_amount": 72,
  "price_currency": "USD",
  "source_url": "https://bluelab.com/products/bluelab-pro-controller-conductivity-probe",
  "source_type": "manufacturer",
  "source_date": "2026-06-28",
  "notes": "Replacement EC/conductivity probe exclusively for Pro Controller (CONTPRO) and Pro Controller Wi-Fi (BCTPRC02). Fully submersible, 2m cable. Not compatible with Guardian Monitor or Combo Meter."
}